{
  "$schema":"https://json-schema.org/draft/2020-12/schema","$id":"https://schemas.event-driven-commerce.test/events/order-cancelled-v1.schema.json","title":"OrderCancelledV1","type":"object","additionalProperties":false,
  "required":["eventId","eventType","eventVersion","aggregateId","correlationId","causationId","occurredAt","payload"],
  "properties":{"eventId":{"type":"string","format":"uuid"},"eventType":{"const":"OrderCancelledV1"},"eventVersion":{"const":1},"aggregateId":{"type":"string","format":"uuid"},"correlationId":{"type":"string","format":"uuid"},"causationId":{"type":"string","format":"uuid"},"occurredAt":{"type":"string","format":"date-time"},"payload":{"type":"object","additionalProperties":false,"required":["orderId","customerId","reasonCode","cancelledAt"],"properties":{"orderId":{"type":"string","format":"uuid"},"customerId":{"type":"string","format":"uuid"},"reasonCode":{"type":"string","minLength":1},"cancelledAt":{"type":"string","format":"date-time"}}}}
}
