{"eventId":"10000000-0000-4000-8000-000000000003","eventType":"OrderCancelledV1","eventVersion":1,"aggregateId":"20000000-0000-4000-8000-000000000001","correlationId":"30000000-0000-4000-8000-000000000001","causationId":"60000000-0000-4000-8000-000000000002","occurredAt":"2026-08-06T20:00:00Z","payload":{"orderId":"20000000-0000-4000-8000-000000000001","customerId":"40000000-0000-4000-8000-000000000001","reasonCode":"INVENTORY_UNAVAILABLE","cancelledAt":"2026-08-06T20:00:00Z"}}
